{
  "id": "bramble-stack",
  "slug": "bramble-stack",
  "name": "Bramble Stack",
  "author": "twobitEDD",
  "authorUrl": "https://github.com/twobitEDD",
  "version": "0.1.0",
  "license": "MIT",
  "description": "Industrial salvage rust chassis with amber-orange CRT accents.",
  "tags": ["dark", "warm", "orange", "industrial"],
  "files": {
    "css": "theme.css",
    "readme": "README.md"
  },
  "homepage": "https://github.com/twobitEDD/console-network",
  "repo": "https://github.com/twobitEDD/console-network",
  "status": "active"
}
